Unnamed: 0,tweets,time,language,translated_tweets
940,"Linksextreme Gewalt – die Szene radikalisiert sich, die Gefahr wird unterschätzt: Die Schweiz ist auf dem linken Auge blind",2021-04-29 05:36:42+00:00,"((0, 126, 'GERMAN', 'de'),)","[{'translation_text': 'Left extreme violence – the scene is radicalizing, the danger is underestimated: Switzerland is blind on the left eye'}]"
941,"Und tschüss: Anonyme Feiglinge, welche nur Schrott schreiben, werden konsequent geblockt!",2021-04-28 09:26:16+00:00,"((0, 90, 'GERMAN', 'de'),)","[{'translation_text': 'And bye: Anonymous cowards, who only write scrap, are consistently blocked!'}]"
942,Anonymer Feigling!,2021-04-28 06:31:00+00:00,"((0, 18, 'Unknown', 'un'),)",NA
943,Was erzählen Sie hier für einen Schwachsinn?,2021-04-28 06:30:37+00:00,"((0, 46, 'GERMAN', 'de'),)",[{'translation_text': 'What kind of bullshit are you talking about?'}]
944,"Ich wollte mich mit Ihnen geistig duellieren - aber ich sehe gerade, Sie sind gänzlich unbewaffnet",2021-04-26 17:20:37+00:00,"((0, 99, 'GERMAN', 'de'),)","[{'translation_text': ""I wanted to duel with you mentally - but I just see you're completely unarmed""}]"
945,Es waren ja auch nicht Sie gemeint - obwohl .... getroffene Hunde bellen ...,2021-04-26 12:58:58+00:00,"((0, 76, 'GERMAN', 'de'),)","[{'translation_text': ""You weren't meant either - although... dogs were barking...""}]"
946,"Solch ein Blödsinn lässt sich wohl nur anonym posten, sie erbärmlicher Feigling!",2021-04-26 12:33:47+00:00,"((0, 83, 'GERMAN', 'de'),)","[{'translation_text': 'You can only post such nonsense anonymously, you pathetic coward!'}]"
947,Nun plötzlich doch nicht? Wir warnen seit Jahren!,2021-04-25 11:30:47+00:00,"((0, 50, 'GERMAN', 'de'),)","[{'translation_text': ""We've been warning for years.""}]"
948,Wir haben bald 200‘000 Arbeitslose ...,2021-04-25 11:11:06+00:00,"((0, 40, 'GERMAN', 'de'),)","[{'translation_text': ""We soon have 200'000 unemployed ...""}]"
949,Schade - ich hätte mich gerne mit Ihnen geistig duelliert - aber ich sehe gerade: Sie sind gänzlich unbewaffnet ...,2021-04-24 18:54:18+00:00,"((0, 117, 'GERMAN', 'de'),)",[{'translation_text': 'Too bad - I would have liked to duel with you mentally - but I see right now: you are completely unarmed ...'}]
950,In welcher der von Ihnen genannten Zeitungen wurde an welchem Datum mein Vorstoss thematisiert ?,2021-04-24 18:37:57+00:00,"((0, 96, 'GERMAN', 'de'),)",[{'translation_text': 'In which of the newspapers you mentioned was the subject of my proposal on which date ?'}]
951,"Also Sie diskutieren im Ernst hier über meinen Vorstoss, ohne konkret zu wissen, worum es geht?",2021-04-24 16:58:10+00:00,"((0, 96, 'GERMAN', 'de'),)",[{'translation_text': 'So you are seriously discussing my proposal here without knowing exactly what it is about?'}]
952,"Ich habe im Interview klar gesagt, worum es geht ... sind Sie auch des Hörens nicht mächtig?",2021-04-24 15:36:23+00:00,"((0, 94, 'GERMAN', 'de'),)","[{'translation_text': ""In the interview, I made it clear what this is about... aren't you capable of hearing either?""}]"
953,"Nein, es geht nicht um die „Mitte“ - bei der ist längst bekannt, dass sie links stimmt",2021-04-23 15:03:33+00:00,"((0, 91, 'GERMAN', 'de'),)","[{'translation_text': 'No, it\'s not about the ""middle"" - it\'s long known that it\'s right on the left.'}]"
954,"Nein, eben nicht! Die Wählerinnen und Wähler haben einen Anspruch darauf zu erfahren, wie die von ihnen Gewählten tatsächlich abstimmen!",2021-04-23 14:48:14+00:00,"((0, 140, 'GERMAN', 'de'),)","[{'translation_text': 'No, not at all! The voters have a right to know how the electors actually vote!'}]"
955,"Ich könnte den EU-Beitritt fordern - sogar hierzu würden Sie einen Grund finden, warum dies rassistisch, schlecht, ungebildet, nicht gendergerecht oder gerade sonstwie nicht passend ist ...",2021-04-23 11:29:40+00:00,"((0, 191, 'GERMAN', 'de'),)","[{'translation_text': 'I could ask for EU membership - even for this you would find a reason why this is racist, bad, uneducated, not gender-appropriate or just not appropriate ...'}]"
956,"Oh, welch grosses Lob, herzlichen Dank",2021-04-23 11:27:51+00:00,"((0, 38, 'GERMAN', 'de'),)","[{'translation_text': 'Oh, how great praise, thanks a lot'}]"
957,"Sind Sie des Lesens mächtig? Ich verlange lediglich die Bekanntgabe der Resultate, nicht den Inhalt der Diskussionen!",2021-04-23 11:27:13+00:00,"((0, 118, 'GERMAN', 'de'),)","[{'translation_text': 'Are you capable of reading? I only demand the announcement of the results, not the content of the discussions!'}]"
959,"Und was er vor dem Ereignis eingeworfen hat, verschweigen Sie ...",2021-04-22 10:50:45+00:00,"((0, 65, 'GERMAN', 'de'),)","[{'translation_text': ""And what he threw in before the event, you're not telling me...""}]"
960,Lesen Sie den Obduktionsbericht ...,2021-04-22 10:34:32+00:00,"((0, 35, 'Unknown', 'un'),)",NA
961,Idioten werden blockiert,2021-04-22 10:08:05+00:00,"((0, 24, 'Unknown', 'un'),)",NA
962,Wen meinen Sie?,2021-04-22 09:43:05+00:00,"((0, 15, 'Unknown', 'un'),)",NA
963,... und lernen Sie dann bitte noch etwas Rechtschreibung!,2021-04-20 14:12:20+00:00,"((0, 57, 'GERMAN', 'de'),)",[{'translation_text': '... and then please learn some spelling!'}]
964,"Legen Sie zuerst einmal Ihre Identität offen, Sie anonymer Feigling!",2021-04-20 14:11:49+00:00,"((0, 69, 'GERMAN', 'de'),)","[{'translation_text': 'First, reveal your identity, you anonymous coward!'}]"
965,"Wäre ja spannend zu wissen, welche echten SVP-ler sich mit einem dunkelroten Kommunisten wie Sie es sind, tatsächlich abgeben ...",2021-04-19 18:25:14+00:00,"((0, 131, 'GERMAN', 'de'),)",[{'translation_text': 'It would be exciting to know which real SVP-lers are actually dealing with a dark red communist like you are ...'}]
966,Reda El Arbi im Phantasieland ...,2021-04-19 15:40:47+00:00,"((0, 33, 'Unknown', 'un'),)",NA
967,You made my day,2021-04-19 14:14:42+00:00,"((0, 15, 'Unknown', 'un'),)",NA
968,"Solange er mitspielt, passt doch kein Blatt Papier dazwischen ...",2021-04-19 14:14:17+00:00,"((0, 65, 'GERMAN', 'de'),)","[{'translation_text': ""As long as he plays along, there's no piece of paper in between ...""}]"
969,"Ja, bei der Mitte bekommen Sie eine klare Politik und Haltung ... (Ironie off)",2021-04-19 14:03:55+00:00,"((0, 78, 'GERMAN', 'de'),)","[{'translation_text': 'Yes, in the middle you get a clear policy and attitude ... (Ironie off)'}]"
970,Nochmals: Da dürfte das Stockholm-Syndrom mitspielen ...,2021-04-19 14:02:53+00:00,"((0, 57, 'GERMAN', 'de'),)",[{'translation_text': 'Again: The Stockholm syndrome should play a part ...'}]
971,"Und ich hoffe, dass Sie gegen den Blackout (vollkommener Zusammenbruch der Stromversorgung) vorgesorgt haben - dagegen ist nämlich die aktuelle Lage ein Honigschlecken ...",2021-04-19 13:28:19+00:00,"((0, 172, 'GERMAN', 'de'),)","[{'translation_text': ""And I hope you've taken care of the blackout (perfect breakdown of the power supply) - because the current situation is a honey slug ...""}]"
972,Sie schrieben: ... Elektro- und ...,2021-04-19 13:19:54+00:00,"((0, 35, 'Unknown', 'un'),)",NA
973,Trompeten Sie doch nicht so einen Mist raus - denn immerhin liesse sich diese Energie - ganz im Gegenteil zum Flatterstrom - wenigstens bunkern!,2021-04-19 13:07:04+00:00,"((0, 144, 'GERMAN', 'de'),)","[{'translation_text': ""Don't make such a fuss out of it - because at least this energy - quite the contrary to the flutter flow - could be bunkered at least!""}]"
974,Nur der Aktualität zuliebe ...,2021-04-19 12:28:17+00:00,"((0, 31, 'GERMAN', 'de'),)",[{'translation_text': 'Only for the sake of topicality ...'}]
976,In gutem Deutsch würde man „wovor“ schreiben ...,2021-04-19 10:45:49+00:00,"((0, 53, 'GERMAN', 'de'),)","[{'translation_text': 'In good German one would write ""wovor"" ...'}]"
977,"Wir brauchen dringend eine schlagkräftige, glaubwürdige und einsatzfähige Armee - und keine Elektropanzer und CO2-Träumer, Frau Bundesrätin Viola Amherd",2021-04-19 10:41:26+00:00,"((0, 157, 'GERMAN', 'de'),)","[{'translation_text': 'We urgently need a powerful, credible and operational army - and no electric tanks and CO2 dreamers, Mrs. Viola Amherd'}]"
978,Vielleicht das Stockholm-Syndrom?,2021-04-19 10:30:21+00:00,"((0, 33, 'GERMAN', 'de'),)",[{'translation_text': 'Maybe Stockholm Syndrome?'}]
979,Wovon träumen Sie in der Nacht?,2021-04-19 10:24:32+00:00,"((0, 32, 'GERMAN', 'de'),)",[{'translation_text': 'What do you dream of at night?'}]
980,Ich bedaure Reto ...,2021-04-19 09:41:38+00:00,"((0, 20, 'Unknown', 'un'),)",NA
981,"Ach, die dauerfrustrierte JSH meldet sich auch mal wieder ....",2021-04-19 08:53:30+00:00,"((0, 62, 'GERMAN', 'de'),)","[{'translation_text': 'Oh, the persistently frustrated JSH is also reporting again ....'}]"
982,Armleuchter!,2021-04-18 18:06:58+00:00,"((0, 12, 'Unknown', 'un'),)",NA
983,"Schade für Ihre Argumentation, dass wir uns gerade in einer Phase der Untersterblichkeit befinden ...",2021-04-18 15:52:20+00:00,"((0, 102, 'GERMAN', 'de'),)",[{'translation_text': 'Too bad for your argument that we are in a phase of immortality ...'}]
984,Also Missstände aufzeigen ist für Sie „hetzen“?,2021-04-18 15:25:44+00:00,"((0, 53, 'GERMAN', 'de'),)","[{'translation_text': 'So pointing out abuses is for you ""incite""?'}]"
985,"Kleiner, anonymer Feigling!",2021-04-18 15:12:59+00:00,"((0, 27, 'Unknown', 'un'),)",NA
986,Nicht alles umdrehen: Das BAG hat andere Angebote nicht mal geprüft!,2021-04-18 07:20:26+00:00,"((0, 69, 'GERMAN', 'de'),)","[{'translation_text': ""Don't turn everything around: the BAG has not even checked other offers!""}]"
987,"Genau - neue Sprachregelung: Wer Missstände anspricht, wird zum Hetzer ernannt ...",2021-04-18 07:19:31+00:00,"((0, 83, 'GERMAN', 'de'),)",[{'translation_text': 'Precisely - new language regulation: Anyone who addresses maladministration is appointed a heretic ...'}]
988,"Typisch links - wenn ein Bürgerlicher dazu aufrufen würde, ginge ein Riesengeheule los!",2021-04-17 18:05:04+00:00,"((0, 89, 'GERMAN', 'de'),)","[{'translation_text': 'Typically left - if a citizen would call for it, a huge howl would go off!'}]"
989,Klimajugend? Wohl eher Klimakommunisten ...,2021-04-17 18:04:03+00:00,"((0, 43, 'GERMAN', 'de'),)",[{'translation_text': 'Climate youth? Probably more climate communists ...'}]
990,Jeden 1. Mai sieht man genau dies!,2021-04-17 18:03:15+00:00,"((0, 34, 'Unknown', 'un'),)",NA
991,Schon wieder Probleme mit dem Impfstoff: Nun müssen beim  Köpfe rollen!,2021-04-17 18:02:32+00:00,"((0, 73, 'GERMAN', 'de'),)",[{'translation_text': 'Problems with the vaccine again: Now have to roll at the head!'}]
992,"Aber sie gingen, um zu arbeiten - und nicht, um den Amis auf der Tasche zu liegen und / oder kriminell zu werden ...",2021-04-17 10:40:42+00:00,"((0, 116, 'GERMAN', 'de'),)",[{'translation_text': 'But they went to work - and not to lie the Americans on the bag and / or become criminal ...'}]
993,Nennen Sie bitte aktuelle Vorkommnisse ...,2021-04-16 19:24:43+00:00,"((0, 42, 'GERMAN', 'de'),)",[{'translation_text': 'Please state current events ...'}]
994,Wo - in welcher Asylunterkunft musste ein Insasse vor einem Angriff geschützt werden?,2021-04-16 15:28:55+00:00,"((0, 86, 'GERMAN', 'de'),)",[{'translation_text': 'Where - in which asylum accommodation an inmate had to be protected from an attack?'}]
995,Was sind denn Sie für ein anonymer Feigling?,2021-04-16 12:46:57+00:00,"((0, 45, 'GERMAN', 'de'),)",[{'translation_text': 'What kind of anonymous coward are you?'}]
996,"Wieso braucht es für Leute, die bei uns angeblich Schutz suchen, alleine im Aargau fast 12 Millionen, um diese Schutzsuchenden vor sich selbst und die Bevölkerung vor ihnen zu schützen?",2021-04-16 10:43:04+00:00,"((0, 188, 'GERMAN', 'de'),)",[{'translation_text': 'Why does it take almost 12 million for people who claim to be seeking protection in the Aargau alone to protect those seeking protection from themselves and the population from them?'}]
997,Wovon träumen Sie nachts?,2021-04-15 19:13:46+00:00,"((0, 26, 'GERMAN', 'de'),)",[{'translation_text': 'What do you dream of at night?'}]
998,"Was die Schweiz in einem Jahr rauslässt, bläst China in einem Tag in die Luft!",2021-04-15 17:50:51+00:00,"((0, 80, 'GERMAN', 'de'),)",[{'translation_text': 'What Switzerland leaves out in a year is blowing up China in one day!'}]
999,Genau das Gegenteil ist wahr: Mit Flatterstrom aus Photovoltaik und Windrädli ist uns nicht geholfen!,2021-04-15 15:38:28+00:00,"((0, 102, 'GERMAN', 'de'),)","[{'translation_text': 'The exact opposite is true: with flutter power from photovoltaics and wind turbines, we are not helped!'}]"
1000,Wir können die Erderwärmung nicht beeinflussen!,2021-04-15 11:28:50+00:00,"((0, 49, 'GERMAN', 'de'),)","[{'translation_text': ""We can't influence global warming!""}]"
1001,"Wer glaubt, die Erderwärmung mittels CO2-Steuer aufhalten zu können, glaubt auch, die Erdumdrehung aufhalten zu können ...",2021-04-15 11:24:29+00:00,"((0, 125, 'GERMAN', 'de'),)","[{'translation_text': ""Those who believe that they can stop global warming by means of CO2 taxes also believe that they can stop the Earth's rotation ...""}]"
1003,Anonymer Feigling !,2021-04-15 11:03:14+00:00,"((0, 19, 'Unknown', 'un'),)",NA
1004,Schaue gerade Bewerbungen an - wann hat eigentlich dieses unsägliche Geschwurbel Einzug in die Zeugnisse gehalten? Klartext fehlt!,2021-04-14 13:46:23+00:00,"((0, 131, 'GERMAN', 'de'),)",[{'translation_text': 'Just look at applications - when did this unspeakable jury actually enter the testimonies? Clear text is missing!'}]
1005,Zufälle gibts ....,2021-04-14 12:13:50+00:00,"((0, 19, 'Unknown', 'un'),)",NA
1006,Dann wäre ja der Blick unanständig - denn so explizit und in dieser Form hat er den Christen noch nie zu Weihnachten gratuliert 🤷‍,2021-04-14 08:17:30+00:00,"((0, 137, 'GERMAN', 'de'),)",[{'translation_text': 'Then the look would be indecent - because so explicit and in this form he has never congratulated the Christians at Christmas'}]
1007,"Lieber  - ist diese Anbiederung wirklich nötig? Und glaubt Ihr wirklich, so Abonnenten zu gewinnen?",2021-04-13 18:08:51+00:00,"((0, 100, 'GERMAN', 'de'),)",[{'translation_text': 'Dear - is this bidding really necessary? And do you really believe in winning subscribers like this?'}]
1008,"Wenn Sie so weitermachen, wird die Quittung bei den nächsten Wahlen folgen ... dann aber bitte nicht klagen ... wir haben gewarnt!",2021-04-13 08:18:05+00:00,"((0, 131, 'GERMAN', 'de'),)","[{'translation_text': ""If you continue like this, the receipt will follow in the next elections ... but please don't complain ... we have warned!""}]"
1009,Leute wie Sie sind für den Untergang der einst stolzen und staatstragenden FDP verantwortlich! Die SVP hat keine Freude am Niedergang der FDP - wir wünschen uns eine starke Mitbewerberin um die besten Ideen!,2021-04-13 05:35:47+00:00,"((0, 209, 'GERMAN', 'de'),)",[{'translation_text': 'People like you are responsible for the downfall of the once proud and state-supporting FDP! The SVP has no pleasure in the downfall of the FDP - we wish a strong competitor for the best ideas!'}]
1010,"Ja, liebe  - es tut weh, wenn wir dies mit Euren beiden nach links abweichenden Bundesräten so direkt ansprechen ... Nun müsst Ihr aber nicht wie unerzogene Kinder im Sandkasten mit Sand schmeissen, sondern Eure beiden Bundesräte für morgen briefen!",2021-04-13 04:07:26+00:00,"((0, 253, 'GERMAN', 'de'),)","[{'translation_text': 'Yes, dear - it hurts if we address this so directly with your two Federal Councillors who differ to the left ... Now you do not have to throw sand like uneducated children in the sandbox, but write your two Federal Councillors for tomorrow!'}]"
1011,"Kleiner, anonymer Feigling!",2021-04-12 13:25:29+00:00,"((0, 27, 'Unknown', 'un'),)",NA
1012,Bei Ihnen müsste wohl eher ‚von vorgestern‘ stehen,2021-04-12 13:24:27+00:00,"((0, 55, 'GERMAN', 'de'),)","[{'translation_text': 'With you it would probably have to be ""from the day before yesterday""'}]"
1013,"Es gibt Grundwerte, die eine bürgerliche, geschweige eine sich liberal nennende Partei nie verraten darf, liebe FDP!",2021-04-11 18:45:35+00:00,"((0, 117, 'GERMAN', 'de'),)","[{'translation_text': 'There are fundamental values that a bourgeois party, let alone a liberal party, must never betray, dear FDP!'}]"
1014,Schluchz,2021-04-09 17:50:35+00:00,"((0, 8, 'Unknown', 'un'),)",NA
1015,Also dies ist für Sie bereits rassistisch?,2021-04-09 16:43:00+00:00,"((0, 43, 'GERMAN', 'de'),)",[{'translation_text': 'So this is already racist for you?'}]
1016,"Gott, lass es Hirn regnen ....",2021-04-09 16:27:51+00:00,"((0, 30, 'Unknown', 'un'),)",NA
1017,Sind Sie des Lesens nicht mächtig? Ich wurde keineswegs verurteilt!,2021-04-09 16:25:07+00:00,"((0, 68, 'GERMAN', 'de'),)",[{'translation_text': 'Are you not capable of reading? I was not condemned by any means!'}]
1018,Wann und von welchem Gericht wurde ich wegen Rassismus verurteilt?,2021-04-09 15:39:38+00:00,"((0, 66, 'GERMAN', 'de'),)",[{'translation_text': 'When and by which court was I convicted of racism?'}]
1019,Lasst uns einen Stuhlkreis bilden und darüber reden ....,2021-04-09 13:29:11+00:00,"((0, 57, 'GERMAN', 'de'),)",[{'translation_text': 'Let us form a circle of chairs and talk about it ....'}]
1020,Rassismus scheint auf sehr tiefer Stufe zu beginnen ...,2021-04-09 10:11:18+00:00,"((0, 55, 'GERMAN', 'de'),)",[{'translation_text': 'Racism seems to start at a very low level ...'}]
1021,"Oh Gott, liebes  - wieso benennt Ihr den Aargau um?",2021-04-09 09:16:50+00:00,"((0, 51, 'GERMAN', 'de'),)","[{'translation_text': 'Oh, God, dear, why are you naming the Aargau?'}]"
1022,Armleuchter !,2021-04-09 07:52:47+00:00,"((0, 13, 'Unknown', 'un'),)",NA
1023,"weigert sich, ein Konto für das Komitee „Ehe für alle“ zu eröffnen - wegen angeblichem Reputationsrisiko ... die hätten mal besser bei Pierin Vincenz genauer hingeschaut!",2021-04-09 06:11:25+00:00,"((0, 94, 'GERMAN', 'de'), (94, 84, 'Unknown', 'un'))","[{'translation_text': 'refuses to open an account for the committee ""Marriage for everyone"" because of alleged reputation risk ... they would have looked better at Pierin Vincenz!'}]"
1024,"Unglaublich, die  Die  und konservativ - die Grünen als Liberale? Da scheinen nebst  auch die beiden Redaktorinnen am Morgen etwas eingeworfen zu haben ...",2021-04-08 16:17:24+00:00,"((0, 156, 'GERMAN', 'de'),)","[{'translation_text': 'Incredible, the Die and conservative - the Greens as liberals? Besides the two editors in the morning seem to have thrown something in ...'}]"
1025,Das ist so unwahr - aber eben: Amonym lässt sich hier der grösste Dreck posten ... und tschüss,2021-04-07 12:44:48+00:00,"((0, 97, 'GERMAN', 'de'),)",[{'translation_text': 'This is so untrue - but just: Amonym can be posted here the biggest dirt ... and bye'}]
1026,Und tschüss !,2021-04-07 12:22:13+00:00,"((0, 14, 'Unknown', 'un'),)",NA
1027,"Wieder ein anonymer Feigling, der seinen Schrott hier absondert ... 🤮",2021-04-07 11:44:52+00:00,"((0, 72, 'GERMAN', 'de'),)",[{'translation_text': 'Again an anonymous coward who separates his scrap from here ...'}]
1028,Wo in all diesen Tätigkeiten hat der Mann auch nur einen Hauch von wirtschaftlichem Handeln erlernt?,2021-04-07 11:34:12+00:00,"((0, 101, 'GERMAN', 'de'),)",[{'translation_text': 'Where in all of these activities has the man learned even a touch of economic action?'}]
1029,Jeder Kebab-Stand hat ein besseres Risk-Management als die,2021-04-07 07:02:10+00:00,"((0, 58, 'GERMAN', 'de'),)",[{'translation_text': 'Each kebab stand has a better risk management than the'}]
1030,Und den Hauptpreis für die kreativste Ausrede erhält - tatata: Thomas Gottstein von der,2021-04-07 06:38:35+00:00,"((0, 89, 'GERMAN', 'de'),)",[{'translation_text': 'And receives the main prize for the most creative excuse - tatata: Thomas Gottstein of the'}]
1031,"Nein, ich habe meine eigenen Geschäfte!",2021-04-05 21:04:12+00:00,"((0, 40, 'GERMAN', 'de'),)","[{'translation_text': 'No, I have my own business!'}]"
1032,"Nein, den Spruch haben Sie nun echt nicht begriffen - was meine Theorie nur bestätigt",2021-04-05 17:55:47+00:00,"((0, 86, 'GERMAN', 'de'),)","[{'translation_text': ""No, you really didn't understand the spell - which just confirms my theory""}]"
1033,"Keine Ausreden, bitte!",2021-04-05 15:28:20+00:00,"((0, 22, 'Unknown', 'un'),)",NA
1034,Dann zeigen Sie uns bitte Ihr Profilbild ...,2021-04-05 15:12:03+00:00,"((0, 44, 'GERMAN', 'de'),)",[{'translation_text': 'Then please show us your profile picture ...'}]
1035,"Eigentlich wollte ich mich hier mit Ihnen geistig duellieren - aber ich sehe gerade, Sie sind gänzlich unbewaffnet ...",2021-04-05 14:28:04+00:00,"((0, 119, 'GERMAN', 'de'),)","[{'translation_text': ""Actually, I wanted to duel here with you mentally - but I see you're completely unarmed...""}]"
1036,"Hergott, lass es Hirn regnen!",2021-04-05 14:08:26+00:00,"((0, 29, 'Unknown', 'un'),)",NA
1039,Noch nicht mal die Rechtschreibung beherrschen - aber hier anonym grosse Töne spucken ... kleiner Feigling!,2021-04-05 14:06:41+00:00,"((0, 108, 'GERMAN', 'de'),)",[{'translation_text': 'Not even master the spelling - but here anonymously big sounds spit ... little coward!'}]
1040,Jedes Land hat eine Armee - entweder eine eigene oder eine fremde!,2021-04-05 11:43:19+00:00,"((0, 66, 'GERMAN', 'de'),)",[{'translation_text': 'Each country has an army - either its own or a foreign one!'}]
1041,Ah ja - wie kommen Sie zu dieser Behauptung?,2021-04-05 05:00:22+00:00,"((0, 44, 'GERMAN', 'de'),)",[{'translation_text': 'Ah yes - how do you come up with this claim?'}]
1042,Disuasion - aber davon scheinen Sie nichts zu verstehen ...,2021-04-04 21:04:25+00:00,"((0, 59, 'GERMAN', 'de'),)","[{'translation_text': ""Disuasion - but you don't seem to understand anything about it...""}]"
1043,... aus dem sicheren Lehnstuhl lässt sich die Geschichte immer gut kritisieren ...,2021-04-04 21:03:37+00:00,"((0, 83, 'GERMAN', 'de'),)",[{'translation_text': '... from the safe armchair the story can always be well criticized ...'}]
1044,Also da würde ich mich an Ihrer Stelle besser wappnen!,2021-04-04 20:17:59+00:00,"((0, 55, 'GERMAN', 'de'),)","[{'translation_text': ""So I'd be better off if I were you!""}]"
1045,Das Chaos haben unsere beiden halben Bundesräte angerichtet ...,2021-04-04 20:14:47+00:00,"((0, 64, 'GERMAN', 'de'),)",[{'translation_text': 'The chaos has been caused by our two half Bundesrats...'}]
1046,Liechtenstein schlagen wir mit der Dorffeuerwehr von Trübbach,2021-04-04 20:13:44+00:00,"((0, 62, 'GERMAN', 'de'),)",[{'translation_text': 'Liechtenstein we beat with the village fire brigade of Trübbach'}]
1047,Also das waren doch komplett andere Voraussetzungen ...,2021-04-04 20:10:51+00:00,"((0, 55, 'GERMAN', 'de'),)",[{'translation_text': 'So these were completely different prerequisites ...'}]
1048,"Ich bin selber Arbeitgeber, zahle korrekte Löhne und behandle meine Mitarbeiter selbstverständlich korrekt!",2021-04-04 19:49:38+00:00,"((0, 109, 'GERMAN', 'de'),)","[{'translation_text': 'I am an employer myself, pay correct wages and, of course, treat my employees correctly!'}]"
1049,Die  hat noch keinen einzigen Arbeitsplatz gerettet - aber durch ihre Politik schon zehntausende Arbeitsplätze verhindert oder gar vernichtet!,2021-04-04 19:34:18+00:00,"((0, 143, 'GERMAN', 'de'),)",[{'translation_text': 'It has not yet saved a single job - but through its policies it has already prevented or even destroyed tens of thousands of jobs!'}]
1051,Also zu meiner Zeit brachte man(n) die Unterwäsche noch selbst mit ...,2021-04-04 10:08:30+00:00,"((0, 71, 'GERMAN', 'de'),)","[{'translation_text': 'So in my day, they brought the underwear with them themselves...'}]"
1052,Riesenchaos und massive Mehrkosten bei den Beschaffungsprojekten der Armee - und Frau BR Amherd kümmert sich um Unterwäsche für die weiblichen Armeeangehörigen ... Führung sieht anders aus!,2021-04-04 09:47:40+00:00,"((0, 194, 'GERMAN', 'de'),)",[{'translation_text': 'Giant chaos and massive additional costs in the procurement projects of the army - and Mrs. BR Amherd takes care of underwear for the female army members ... Leadership looks different!'}]
1053,Immer über Abzocker und mangelnde Frauenquote schimpfen - sich dann aber gegenseitig die lukrativsten Pöstli zuschanzen: Typisch Sozialisten!,2021-04-04 08:42:20+00:00,"((0, 143, 'GERMAN', 'de'),)",[{'translation_text': 'Always scolding about abzockers and a lack of female quota - but then the most lucrative Pöstli jump to each other: Typical socialists!'}]
1056,"Stimmt, sorry!",2021-04-03 18:50:40+00:00,"((0, 14, 'Unknown', 'un'),)",NA
1057,Sie haben sich gerade eine saftige Strafanzeige eingehandelt ...,2021-04-03 18:15:02+00:00,"((0, 64, 'GERMAN', 'de'),)",[{'translation_text': 'You just got yourself a sue lawsuit...'}]
1058,"Bin nicht der Einzige, der massive Zweifel hat ...",2021-04-03 17:55:56+00:00,"((0, 50, 'GERMAN', 'de'),)","[{'translation_text': ""I'm not the only one who has massive doubts...""}]"
1059,Und das sehen auch Andere so!,2021-04-03 17:54:16+00:00,"((0, 29, 'GERMAN', 'de'),)",[{'translation_text': 'And others see it that way!'}]
1060,"Ja, gerne - aber leider hat die FDP den bürgerlichen Kompass komplett verloren ...",2021-04-03 17:05:05+00:00,"((0, 83, 'GERMAN', 'de'),)","[{'translation_text': 'Yes, gladly - but unfortunately the FDP has completely lost the bourgeois compass ...'}]"
1061,Also KKS und Cassis sind definitiv nicht mehr bürgerlich!,2021-04-03 16:48:06+00:00,"((0, 58, 'GERMAN', 'de'),)",[{'translation_text': 'So PPS and Cassis are definitely no longer bourgeois!'}]
