Unnamed: 0,tweets,time,language,translated_tweets
1285,"Übelster Schmierenjournalismus des Tages-Anzeigers! Ich wusste nicht einmal, dass ich in dieser Gruppe als Admin geführt wurde. Selbstverständlich verurteile ich jegliche Form von Gewaltaufrufen! Ich werde rechtliche Schritte gegen die wirklichen Administratoren prüfen!",2021-02-27 13:52:42+00:00,"((0, 274, 'GERMAN', 'de'),)","[{'translation_text': ""Worst gypsy journalism of the Tages-Anzeiger! I didn't even know that I was run as an admin in this group. Of course, I condemn any form of violence! I'm going to check legal action against the real administrators!""}]"
1286,"Übelster Schmierenjournalismus des Tages-Anzeigers! Ich wusste nicht einmal, dass ich in dieser Gruppe als Admin geführt wurde. Selbstverständlich verurteile ich jegliche Form von Gewaltaufrufen! Ich werde rechtliche Schritte gegen die wirklichen Administratoren prüfen!",2021-02-27 13:52:16+00:00,"((0, 274, 'GERMAN', 'de'),)","[{'translation_text': ""Worst gypsy journalism of the Tages-Anzeiger! I didn't even know that I was run as an admin in this group. Of course, I condemn any form of violence! I'm going to check legal action against the real administrators!""}]"
1287,"Übelster Schmierenjournalismus des Tages-Anzeigers! Ich wusste nicht einmal, dass ich in dieser Gruppe als Admin geführt wurde. Selbstverständlich verurteile ich jegliche Form von Gewaltaufrufen! Ich werde rechtliche Schritte gegen die wirklichen Administratoren prüfen!",2021-02-27 13:51:41+00:00,"((0, 274, 'GERMAN', 'de'),)","[{'translation_text': ""Worst gypsy journalism of the Tages-Anzeiger! I didn't even know that I was run as an admin in this group. Of course, I condemn any form of violence! I'm going to check legal action against the real administrators!""}]"
1288,"Übelster Schmierenjournalismus des Tages-Anzeigers! Ich wusste nicht einmal, dass ich in dieser Gruppe als Admin geführt wurde. Selbstverständlich verurteile ich jegliche Form von Gewaltaufrufen! Ich werde rechtliche Schritte gegen die wirklichen Administratoren prüfen!",2021-02-27 13:51:26+00:00,"((0, 274, 'GERMAN', 'de'),)","[{'translation_text': ""Worst gypsy journalism of the Tages-Anzeiger! I didn't even know that I was run as an admin in this group. Of course, I condemn any form of violence! I'm going to check legal action against the real administrators!""}]"
1289,Das ist übelster Schmierenjournalismus des Tagi-Konzerns!,2021-02-26 22:21:32+00:00,"((0, 58, 'GERMAN', 'de'),)","[{'translation_text': ""This is Tagi's worst lubricating journalism!""}]"
1290,Das ist übelster Schmierenjournalismus des Tagi-Konzerns!,2021-02-26 22:20:43+00:00,"((0, 58, 'GERMAN', 'de'),)","[{'translation_text': ""This is Tagi's worst lubricating journalism!""}]"
1291,"Bitte informieren Sie sich wenigstens, bevor Sie solchen Schrott schreiben!",2021-02-26 15:20:14+00:00,"((0, 75, 'GERMAN', 'de'),)",[{'translation_text': 'Please at least inform yourself before you write such junk!'}]
1292,"Nein, nachdem ich meinen Arbeitstag um 04.15 begonnen hatte, gönnte ich mir um 07.50 einen Kaffee",2021-02-26 08:37:57+00:00,"((0, 98, 'GERMAN', 'de'),)","[{'translation_text': 'No, after I started my working day at 04.15, I had a coffee at 07.50'}]"
1293,Erst? Dann ist ein anständiger Arbeiter doch bereits das erste Mal müde ...,2021-02-26 07:55:19+00:00,"((0, 77, 'GERMAN', 'de'),)",[{'translation_text': 'Then a decent worker is already tired for the first time ...'}]
1295,"07.50 und noch kein böser Tweet gegen die SVP - wann beginnen die eigentlich zu arbeiten in den Beamtenstuben, an den Unis und in der Sozialindustrie?",2021-02-26 06:51:10+00:00,"((0, 151, 'GERMAN', 'de'),)","[{'translation_text': ""07.50 and not yet a bad tweet against the SVP - when do they actually start to work in the civil servants' offices, at the universities and in the social industry?""}]"
1296,"Genau mit diesem Denken kam die Schweiz in die Situation, in der sie heute steckt! Die „Bürgerlichen“ kamen mit dem Kompromiss anstelle eines Standpunkts in die Verhandlungen - und rot/grün lief mit 3/4 des von ihnen Gewünschten aus der Sitzung ...",2021-02-25 21:53:08+00:00,"((0, 255, 'GERMAN', 'de'),)","[{'translation_text': 'This is exactly how Switzerland got into the situation in which it is today! The ""citizens"" came to the negotiations with the compromise instead of a position - and red/green ran with 3/4 of the one they wanted from the meeting ...'}]"
1297,Die SVP bietet jederzeit Hand für tragfähige Lösungen. Wir kommen mit einem klaren Standpunkt in die Verhandlungen - sind aber kompromissbereit. Niemals werden wir aber unsere Grundwerte aufgeben!,2021-02-25 20:47:55+00:00,"((0, 199, 'GERMAN', 'de'),)",[{'translation_text': 'The SVP offers a hand for sustainable solutions at all times. We come to the negotiations with a clear point of view - but are ready to compromise. We will never give up our basic values!'}]
1298,Absolut,2021-02-25 20:05:20+00:00,"((0, 7, 'Unknown', 'un'),)",NA
1299,"Sie haben ja keine Ahnung von den wahren Verhältnissen - aber schön, dass wenigstens Sie noch der Presse glauben ...",2021-02-25 19:44:31+00:00,"((0, 118, 'GERMAN', 'de'),)",[{'translation_text': 'You have no idea of the true conditions - but nice that at least you still believe the press ...'}]
1300,Kämpfen / diskutieren Sie bitte mit offenem Visier!,2021-02-25 17:12:39+00:00,"((0, 52, 'GERMAN', 'de'),)",[{'translation_text': 'Fight / discuss with open visor!'}]
1301,Sind Sie alkoholisiert? Ich hoffe es ...,2021-02-25 12:11:49+00:00,"((0, 40, 'GERMAN', 'de'),)",[{'translation_text': 'Are you alcoholic?'}]
1302,"Wohnen, wo man arbeitet? Das mache ich seit 1994!",2021-02-25 12:03:07+00:00,"((0, 49, 'GERMAN', 'de'),)","[{'translation_text': ""Living where you work? I've been doing it since 1994!""}]"
1303,Genau - und dank all den schönen neuen Elektroautos wird dies sicher auch gelingen,2021-02-25 06:07:08+00:00,"((0, 83, 'GERMAN', 'de'),)",[{'translation_text': 'Precisely - and thanks to all the beautiful new electric cars this will surely also succeed'}]
1304,"Dass BR Berset und BR Sommaruga so entscheiden, ist verständlich ... es sind  ja beide Sozialisten! Bei BR Amherd ist es auch verständlich, denn die „Mitte“ ist ja nur noch die katholische SP ... Dass aber BR Karin Keller-Suter und BR Cassis den Linken helfen, ist himmeltraurig!",2021-02-24 14:43:14+00:00,"((0, 285, 'GERMAN', 'de'),)","[{'translation_text': 'It is understandable that BR Berset and BR Sommaruga decide this way ... they are both socialists! At BR Amherd it is also understandable, because the ""middle"" is only the Catholic SP ... But the fact that BR Karin Keller-Suter and BR Cassis help the left is very sad!'}]"
1306,Und Euch „Perlen“ entlarven wir - dann kommt’s knüppeldick!,2021-02-24 11:09:17+00:00,"((0, 66, 'GERMAN', 'de'),)","[{'translation_text': 'And to you ""beads"" we expose - then comes a sticky thick!'}]"
1307,"Sie haben gar keine Ahnung, in welchen Unternehmen ich tätig bin - aber erzählen hier anonym einfach ein bisschen Schrott ... toll!",2021-02-24 11:08:08+00:00,"((0, 133, 'GERMAN', 'de'),)",[{'translation_text': 'You have no idea in which company I work - but here anonymously just tell a bit of junk ... great!'}]
1309,"Wenn Sie offen mit Ihrem Namen hinstehen, statt hier anonym aus der versteckten (Beamten-?) Stube heraus solchen Schrott verbreiten, können wir gerne darüber reden!",2021-02-24 10:59:12+00:00,"((0, 166, 'GERMAN', 'de'),)","[{'translation_text': 'If you stand open with your name, instead of here anonymously spreading out of the hidden (official?) room such junk, we can talk about it!'}]"
1310,Sie fühlen sich als Sprachpolizist?,2021-02-24 08:45:06+00:00,"((0, 36, 'GERMAN', 'de'),)",[{'translation_text': 'You feel like a language cop?'}]
1311,Da sind Sie mit Ihrem offensichtlich begrenzten Horizont leider nicht allzu massgebend ...,2021-02-24 08:35:44+00:00,"((0, 90, 'GERMAN', 'de'),)","[{'translation_text': 'Unfortunately, with your obviously limited horizon, you are not too decisive ...'}]"
1312,Sie haben es schon wieder falsch geschrieben,2021-02-24 08:34:41+00:00,"((0, 44, 'GERMAN', 'de'),)","[{'translation_text': ""You've written it wrong again""}]"
1314,Aber sicher !,2021-02-24 08:03:54+00:00,"((0, 13, 'Unknown', 'un'),)",NA
1315,Die Sprachpolizei,2021-02-24 08:02:58+00:00,"((0, 17, 'Unknown', 'un'),)",NA
1317,"Es ist eine krasse Verharmlosung der unbeschreiblichen Verbrechen der Nazis, wenn man „Schweizer, erwachet“ als antisemitisch bezeichnet! Hört auf mit dieser Rassismuskeule - es nützt sich ab!",2021-02-24 08:00:05+00:00,"((0, 198, 'GERMAN', 'de'),)","[{'translation_text': 'It is a blatant trivialization of the indescribable crimes of the Nazis when one calls ""Swiss, awake, anti-Semitic! Stop with this rascal - it benefits!'}]"
1319,"Und ich fordere, dass Sie Rechtschreibung üben!",2021-02-23 22:21:38+00:00,"((0, 48, 'GERMAN', 'de'),)",[{'translation_text': 'And I demand that you practice spelling!'}]
1320,Ich wurde immerhin gewählt - bei den berechtigten Asylbewerbern wie auch bei Asylbetrügern können wir in der Regel nicht wählen - aber meistens bezahlen ...,2021-02-23 21:04:55+00:00,"((0, 160, 'GERMAN', 'de'),)","[{'translation_text': 'After all, I was elected - with the eligible asylum seekers as well as with asylum fraudsters we usually cannot choose - but mostly pay ...'}]"
1321,"Ich bin sofort dafür, unsere Gehälter zu halbieren - leider machte beim letzten Vorstoss fast niemand mit ...",2021-02-23 20:26:05+00:00,"((0, 111, 'GERMAN', 'de'),)","[{'translation_text': 'I am immediately in favour of halving our salaries - unfortunately, at the last advance almost no one was involved ...'}]"
1322,Was unterstellen Sie mir?,2021-02-23 20:24:30+00:00,"((0, 25, 'GERMAN', 'de'),)",[{'translation_text': 'What are you implying?'}]
1323,"Es ist derart absurd, mir zu unterstellen, ich sei Antisemit! Es gibt Redewendungen, die allgemein Verwendung finden. Oder darf man auch nicht mehr „Autobahn“ oder „Führerschein“ sagen?",2021-02-23 19:22:42+00:00,"((0, 194, 'GERMAN', 'de'),)","[{'translation_text': 'It is so absurd to assume that I am an anti-Semite! There are phrases that are commonly used. Or can one no longer say ""motorway"" or ""driver\'s license""?'}]"
1324,Und Sie der feige anonyme Schreiberling ...,2021-02-23 16:45:17+00:00,"((0, 43, 'GERMAN', 'de'),)","[{'translation_text': ""And you're the cowardly anonymous writer...""}]"
1325,Das BAG muss mit dem eisernen Besen ausgemistet werden!,2021-02-23 16:36:50+00:00,"((0, 55, 'GERMAN', 'de'),)",[{'translation_text': 'The BAG must be cut out with the iron broom!'}]
1326,Das BAG muss mit dem eisernen Besen ausgemistet werden!,2021-02-23 16:36:11+00:00,"((0, 55, 'GERMAN', 'de'),)",[{'translation_text': 'The BAG must be cut out with the iron broom!'}]
1327,"Ich diskutiere hier nur mit Personen, welche ihre Identität offenlegen!",2021-02-23 16:31:19+00:00,"((0, 72, 'GERMAN', 'de'),)","[{'translation_text': ""I'm only discussing here with people who reveal their identity!""}]"
1328,Klartext zum Lockdown,2021-02-23 15:44:02+00:00,"((0, 21, 'Unknown', 'un'),)",NA
1329,Sie sind vor allem rot ! (ausser NR Bäumle),2021-02-23 12:35:53+00:00,"((0, 44, 'GERMAN', 'de'),)",[{'translation_text': 'They are mainly red ! (except NR Bäumle)'}]
1330,"Wissen Sie, was uns die Dame und ihre Familie bis heute allenfalls gekostet haben?",2021-02-23 07:47:12+00:00,"((0, 82, 'GERMAN', 'de'),)",[{'translation_text': 'Do you know what the lady and her family have cost us to this day?'}]
1331,Zu meinen Schutz ohne Kommentar,2021-02-23 06:43:10+00:00,"((0, 31, 'Unknown', 'un'),)",NA
1332,... ich habe und hätte Sie nie erwähnt ...,2021-02-21 19:08:22+00:00,"((0, 44, 'GERMAN', 'de'),)",[{'translation_text': '... I never mentioned you...'}]
1333,Ausser natürlich die der vereinigten Linken und der grün lackierten Linken ...,2021-02-21 15:14:50+00:00,"((0, 80, 'GERMAN', 'de'),)",[{'translation_text': 'Except of course those of the united left and the green painted left ...'}]
1334,"Es geht ja auch noch um Hooligans, Chaoten des Schwarzen Blocks und ähnliche linke Strolche",2021-02-20 16:20:50+00:00,"((0, 92, 'GERMAN', 'de'),)","[{'translation_text': ""It's also about hooligans, black block chaotes and similar left strolches.""}]"
1335,"Es geht ja auch noch um Hooligans, Chaoten des Schwarzen Blocks und ähnliche linke Strolche",2021-02-20 16:20:10+00:00,"((0, 92, 'GERMAN', 'de'),)","[{'translation_text': ""It's also about hooligans, black block chaotes and similar left strolches.""}]"
1336,Gelebter Antirassismus: 13jährige in Bahn vergewaltigt - 40 Minuten lang hilft niemand!,2021-02-20 12:24:46+00:00,"((0, 88, 'GERMAN', 'de'),)",[{'translation_text': 'Lived antiracism: 13-year-old raped in train - for 40 minutes nobody helps!'}]
1337,Sparen Sie sich Ihre Sternchen,2021-02-20 12:22:47+00:00,"((0, 30, 'Unknown', 'un'),)",NA
1338,Genau !,2021-02-20 12:02:05+00:00,"((0, 7, 'Unknown', 'un'),)",NA
1339,Als Gemeindeammann erhielt ich 24‘000.— pro Jahr - die Gehälter der Parlamentarier können Sie auf  nachsehen - sind brutto rund 130‘000.— pro Jahr - meines Erachtens eindeutig zu viel !,2021-02-20 07:26:36+00:00,"((0, 195, 'GERMAN', 'de'),)","[{'translation_text': ""As a parish administrator I received 24'000.— per year - you can look at the salaries of the parliamentarians - are gross about 130'000.— per year - in my opinion clearly too much!""}]"
1340,Sehen so unsere Parteimitglieder aus?,2021-02-19 17:25:33+00:00,"((0, 37, 'GERMAN', 'de'),)",[{'translation_text': 'Do these look like our party members?'}]
1343,"Es reicht, Ihr linken Weltverbesser - wir haben genug vom undemokratischen Zerstörungen unserer Plakate! Wo bleibt der Aufruf der  , der  und Konsorten an ihre Mitglieder und Sympathisanten, diesem üblen Treiben endlich Einhalt zu gebieten?",2021-02-19 14:14:38+00:00,"((0, 242, 'GERMAN', 'de'),)","[{'translation_text': 'Enough, your left world better - we have enough of the undemocratic destruction of our posters! Where is the call of those who and consorts to their members and sympathizers to finally stop this evil activity?'}]"
1345,"Übers Wochenende wird es ruhiger - dann haben die Linken in den Beamtenstuben, an der Uni und in den Sozialfirmen frei ...",2021-02-19 13:13:27+00:00,"((0, 123, 'GERMAN', 'de'),)","[{'translation_text': ""During the weekend it gets quieter - then the left in the civil servants' rooms, at the university and in the social companies free ...""}]"
1346,Die SP hat prozentual mehr Millionäre bei den Mitgliedern,2021-02-19 13:03:28+00:00,"((0, 58, 'GERMAN', 'de'),)",[{'translation_text': 'The SP has more millionaires as a percentage of members'}]
1347,"Das war keine Studie, sondern eine Antwort der Bundesregierung",2021-02-19 11:46:28+00:00,"((0, 62, 'GERMAN', 'de'),)","[{'translation_text': 'This was not a study, but a response from the Federal Government'}]"
1348,Antwort der Bundesregierung auf eine Anfrage ...,2021-02-19 11:45:08+00:00,"((0, 48, 'GERMAN', 'de'),)","[{'translation_text': ""The Federal Government's answer to a question ...""}]"
1349,"Bei 378 Brandanschlägen, die 2018 und 2019 in D verübt wurden, haben das BKA bzw.  die Polizei politische Motive ermittelt: 

308 Mal war es eine LINKE politische Motivation;
20 Mal war es eine ISLAMISTISCHE politische Motivation;
17 Mal war es eine RECHTE politische Motivation",2021-02-19 09:42:47+00:00,"((0, 280, 'GERMAN', 'de'),)","[{'translation_text': 'In the case of 378 attacks in D in 2018 and 2019, the BKA or the police have identified political motives: 308 times it was a LINKE political motivation; 20 times it was an ISLAMISTICAL political motivation; 17 times it was a RIGHT political motivation'}]"
1351,Juhui - auch die Sozialisten werden der Verhüllungsinitiative zustimmen!,2021-02-18 06:17:03+00:00,"((0, 73, 'GERMAN', 'de'),)",[{'translation_text': 'Juhui - also the socialists will agree to the cover-up initiative!'}]
1352,... und die Erde ist eine Scheibe.,2021-02-18 06:15:06+00:00,"((0, 34, 'GERMAN', 'de'),)",[{'translation_text': '... and the earth is a disk.'}]
1353,Die notorischen SVP-Gegner vom Club Helvétique kommen aus der Versenkung. Grund ist die breite Zustimmung für die Burka-Initiative,2021-02-18 06:10:34+00:00,"((0, 132, 'GERMAN', 'de'),)",[{'translation_text': 'The notorious SVP opponents of Club Helvétique come from the sinking. The reason is the broad support for the Burka initiative'}]
1355,"Die Wähöerschaft kaum ...  Gott, hat Twitter wirklich keinen Filter für Rechtschreibung?",2021-02-17 07:58:33+00:00,"((0, 91, 'GERMAN', 'de'),)","[{'translation_text': 'The courtship hardly ... God, does Twitter really have no filter for spelling?'}]"
1356,Sie scheinen schon lange nicht mehr dort gewesen zu sein ...,2021-02-16 20:50:59+00:00,"((0, 60, 'GERMAN', 'de'),)","[{'translation_text': ""You don't seem to have been there for a long time...""}]"
1357,"Wir wollen diese Tücher nicht bei uns - wir haben eine christlich-abendländische Kultur! Erstaunlich, dass sie SP-Feminist*innen hier nicht helfen, die Frauen von diesem ummenschlichen Stoffgefängnis zu befreien!",2021-02-16 20:31:41+00:00,"((0, 215, 'GERMAN', 'de'),)","[{'translation_text': ""We don't want these scarves with us - we have a Christian-Abendland culture! Amazing that they don't help SP feminists here to free the women from this umhuman fabric prison!""}]"
1359,"Bitte lesen Sie nochmals, was Sie für einen blanken Unsinn geschrieben haben ... ich kann Ihnen gerne ein Institut empfehlen, welches auch bei schwierigen Fällen recht gute Ergebnisse erzielt ...",2021-02-16 17:54:16+00:00,"((0, 197, 'GERMAN', 'de'),)","[{'translation_text': 'Please read again, what you have written for a bare nonsense ... I can recommend you an institute, which achieves quite good results even in difficult cases ...'}]"
1360,„Patlament“ hätte meine Tochter nicht mal im Kindergarten falsch geschrieben,2021-02-16 15:49:05+00:00,"((0, 81, 'GERMAN', 'de'),)","[{'translation_text': '""My daughter wouldn\'t even have written wrong in kindergarten'}]"
1361,"„Amdseid“ 🤪🤪 oh Gott, lass es Hirn regnen",2021-02-16 15:46:43+00:00,"((0, 51, 'NAURU', 'na'),)",NA
1362,"Ein noch besserer Anfang wäre, wenigstens die Rechtschreibung zu beherrschen ... „währe“ mit „h“ war also schon in der dritten Klasse tabu",2021-02-16 15:45:03+00:00,"((0, 148, 'GERMAN', 'de'),)","[{'translation_text': 'An even better beginning would be to at least control the spelling ... ""during with ""h"" was therefore already taboo in the third class'}]"
1363,"Die SVP ist nicht gerade bekannt dafür, vor Magistraten zu kuschen. Die Aufarbeitung muss erfolgen! Aber Achtung: Nach einer sorgfältigen Aufarbeitung wird im BAG kein Stein mehr auf dem anderen stehen ... Welches das richtige Instrument ist, muss noch festgelegt werden ...",2021-02-16 07:54:52+00:00,"((0, 276, 'GERMAN', 'de'),)","[{'translation_text': 'The SVP is not exactly known for kissing before magistrates. The reprocessing has to take place! But beware: after a careful reprocessing no stone will stand on the other in the BAG ... which is the right instrument, must still be determined ...'}]"
1364,"Liebe  - es braucht für den Ausstieg keinen 100-Tage-Aktionsplan, sondern ein 15-Minuten-Gespräch mit Euren beiden Bundesräten ...",2021-02-16 06:02:52+00:00,"((0, 133, 'GERMAN', 'de'),)","[{'translation_text': 'Love - it does not need a 100-day action plan for the exit, but a 15-minute conversation with your two Federal Councils ...'}]"
1365,Difframieren,2021-02-15 21:02:57+00:00,"((0, 12, 'Unknown', 'un'),)",NA
1366,Wenn Twitter doch nur korrekt geschriebene Tweets zulassen würde ...,2021-02-15 21:02:29+00:00,"((0, 69, 'GERMAN', 'de'),)",[{'translation_text': 'If Twitter only allowed correctly written tweets ...'}]
1367,"Ich bitte darum! Würde mich schämen, von einem solchen Linken gewählt zu werden!",2021-02-15 15:36:24+00:00,"((0, 83, 'GERMAN', 'de'),)",[{'translation_text': 'Would I be ashamed to be elected by such a left?'}]
1368,"Haben Sie Mühe, einen einfachen Text zu verstehen? Die Täter werden der Justiz zugeführt!",2021-02-15 15:34:57+00:00,"((0, 92, 'GERMAN', 'de'),)",[{'translation_text': 'Do you have any trouble understanding a simple text? The perpetrators are brought to justice!'}]
1369,Scheisskälte - wo ist nur Greta?,2021-02-15 15:33:39+00:00,"((0, 33, 'Unknown', 'un'),)",NA
1370,"Solches schreiben Sie wohl nur anonym, Sie kleiner, erbärmlicher Wicht!",2021-02-15 14:14:10+00:00,"((0, 72, 'GERMAN', 'de'),)","[{'translation_text': ""That's what you write anonymously, you little, pathetic wuss!""}]"
1371,LDU = Landesring der Untergehenden,2021-02-15 10:01:08+00:00,"((0, 34, 'GERMAN', 'de'),)",[{'translation_text': 'LDU = Land ring of the disembarked'}]
1372,Nächste Woche gehen die Belohnungen raus!,2021-02-14 20:13:29+00:00,"((0, 42, 'GERMAN', 'de'),)","[{'translation_text': 'Next week, the rewards go out!'}]"
1373,"Nein, alles korrekt!",2021-02-14 19:59:33+00:00,"((0, 20, 'Unknown', 'un'),)",NA
1374,"Die linken Profi-SVP-Basher sind am Wochenende jeweils immer so verdächtig ruhig ... Bestätigt dies meine Theorie, dass diese Stimmen mehrheitlich aus Beamtenstuben, der Sozialindustrie und dem Uni-Umfeld stammen?",2021-02-14 19:55:16+00:00,"((0, 215, 'GERMAN', 'de'),)","[{'translation_text': ""The left-wing professional-SVP-Bashers are always so suspiciously quiet on the weekend ... Does this confirm my theory that these voices are mostly from civil servants' offices, the social industry and the university environment?""}]"
1375,Kopfgeld wirkt: Schon 4 Plakatschänder erwischt - offensichtlich alle aus linkem Umfeld und mehrheitlich mit Migrationshintergrund - werden nun der Justiz zugeführt ...,2021-02-14 19:31:54+00:00,"((0, 170, 'GERMAN', 'de'),)",[{'translation_text': 'Bounty works: Already 4 billboards caught - obviously all from the left and mostly with a migration background - are now fed to the justice ...'}]
1376,FAM wäscht der Genossin Funiciello so richtig die Kappe! Frank A. Meyer – die Kolumne: Genossinnen im Irrgarten,2021-02-14 17:40:57+00:00,"((0, 114, 'Unknown', 'un'),)",NA
1377,Jedenfalls kassieren sie noch das Gehalt ...,2021-02-14 17:32:59+00:00,"((0, 44, 'GERMAN', 'de'),)","[{'translation_text': 'Anyway, they still collect the salary...'}]"
1378,"Oh, welche Ehre - der Gründer des linksten Portal der Schweiz, mit welchem Wanner seit Jahren nur Geld in den Sand setzt ...",2021-02-12 18:27:54+00:00,"((0, 125, 'GERMAN', 'de'),)","[{'translation_text': 'Oh, what honor - the founder of the left portal of Switzerland, with which Wanner has only put money into the sand for years ...'}]"
1379,"Also wenn Sie keine Ahnung von politischen Abläufen haben, wird eine Diskussion echt schwierig ...",2021-02-12 18:26:15+00:00,"((0, 99, 'GERMAN', 'de'),)","[{'translation_text': 'So if you have no idea of political processes, a discussion will be really difficult...'}]"
1380,"Also wenn Sie keine Ahnung von politischen Abläufen haben, wird eine Diskussion echt schwierig ...",2021-02-12 18:25:48+00:00,"((0, 99, 'GERMAN', 'de'),)","[{'translation_text': 'So if you have no idea of political processes, a discussion will be really difficult...'}]"
1381,"Also wenn Sie keine Ahnung von politischen Abläufen haben, wird eine Diskussion echt schwierig ...",2021-02-12 17:27:50+00:00,"((0, 99, 'GERMAN', 'de'),)","[{'translation_text': 'So if you have no idea of political processes, a discussion will be really difficult...'}]"
1382,"Also wenn Sie keine Ahnung von politischen Abläufen haben, wird eine Diskussion echt schwierig ...",2021-02-12 17:27:32+00:00,"((0, 99, 'GERMAN', 'de'),)","[{'translation_text': 'So if you have no idea of political processes, a discussion will be really difficult...'}]"
1383,"Also wenn Sie keine Ahnung von politischen Abläufen haben, wird eine Diskussion echt schwierig ...",2021-02-12 17:26:18+00:00,"((0, 99, 'GERMAN', 'de'),)","[{'translation_text': 'So if you have no idea of political processes, a discussion will be really difficult...'}]"
1384,....,2021-02-12 17:25:06+00:00,(),NA
1385,Oh Gott - es ist sogar ein Bericht des Bundesrates !,2021-02-12 16:02:50+00:00,"((0, 52, 'GERMAN', 'de'),)","[{'translation_text': ""Oh, God, it's even a report from the Federal Council!""}]"
1387,"Spannend hier auf Twitter: Was Euch nicht passt, wird einfach angezweifelt ... trotz klaren Belegen",2021-02-12 15:05:56+00:00,"((0, 99, 'GERMAN', 'de'),)","[{'translation_text': ""Exciting here on Twitter: What you don't like is simply doubted ... despite clear evidence""}]"
1389,Sie meinen eine der Vernehmlassungsantworten .... Sie scheinen das Dokument nicht zu begreifen,2021-02-12 14:19:27+00:00,"((0, 94, 'GERMAN', 'de'),)","[{'translation_text': ""You mean one of the hearings .... You don't seem to understand the document""}]"
1390,„Vergessen“,2021-02-12 14:17:37+00:00,"((0, 15, 'Unknown', 'un'),)",NA
1393,"Also wenn die Wahrheit für Soe destruktiv ist, wird es etwas schwierig ...",2021-02-12 12:23:14+00:00,"((0, 75, 'GERMAN', 'de'),)","[{'translation_text': ""So if the truth is destructive for Soe, it's going to be a little difficult...""}]"
1401,"Was denken Sie - dauert es noch lange, bis Sie Ihren offensichtlichen Hass auf SVP-Männer wieder im Griff haben?",2021-02-12 11:22:16+00:00,"((0, 113, 'GERMAN', 'de'),)",[{'translation_text': 'What do you think - it will take a long time for you to regain control of your obvious hatred of SVP men?'}]
